{
  "$schema": "http://json-schema.org/draft-07/schema#",
  "$id": "https://example.local/schemas/user_record.schema.json",
  "title": "Renewal scoring record (T-7)",
  "description": "One paying subscriber seven days before a monthly renewal. No label: the renewal is ahead. Aligns with FEATURE_COLUMNS in src/retention_radar/config.py.",
  "type": "object",
  "additionalProperties": false,
  "required": [
    "user_id",
    "user_name",
    "plan_tier",
    "renewals_completed",
    "active_days_7d",
    "active_days_28d",
    "engagement_trend",
    "last_active_days_ago",
    "agent_requests_28d",
    "allowance_used_pct",
    "limit_hits_14d",
    "cheap_model_share_28d",
    "overage_usd_28d",
    "overage_toggled_off",
    "suggestion_accept_rate_28d",
    "accept_rate_change",
    "agent_task_success_rate",
    "failed_requests_rate",
    "incident_exposed_28d",
    "support_tickets_90d",
    "ide_sessions_28d",
    "cli_sessions_28d",
    "weekend_usage_ratio",
    "first_renewal_after_pricing_change"
  ],
  "properties": {
    "user_id": {
      "type": "string",
      "minLength": 1
    },
    "user_name": {
      "type": "string",
      "minLength": 1
    },
    "plan_tier": {
      "type": "string",
      "enum": [
        "pro",
        "pro_plus",
        "ultra"
      ],
      "description": "Monthly plan: pro ($20) | pro_plus ($60) | ultra ($200)."
    },
    "renewals_completed": {
      "type": "number",
      "minimum": 0,
      "maximum": 60,
      "description": "Monthly renewals already paid. 0 = this is the first renewal (the cliff)."
    },
    "active_days_7d": {
      "type": "number",
      "minimum": 0,
      "maximum": 7,
      "description": "Days with any coding activity in the 7 days before T-7 (0-7)."
    },
    "active_days_28d": {
      "type": "number",
      "minimum": 0,
      "maximum": 28,
      "description": "Days with any coding activity in the 28 days before T-7 (0-28)."
    },
    "engagement_trend": {
      "type": "number",
      "minimum": 0.0,
      "maximum": 4.0,
      "description": "active_days_7d / max(1, active_days_28d / 4): ~1 steady, <1 fading."
    },
    "last_active_days_ago": {
      "type": "number",
      "minimum": 0,
      "maximum": 90,
      "description": "Days since the last coding activity, measured at T-7."
    },
    "agent_requests_28d": {
      "type": "number",
      "minimum": 0,
      "maximum": 50000,
      "description": "Agent / chat requests sent to frontier models in 28 days."
    },
    "allowance_used_pct": {
      "type": "number",
      "minimum": 0.0,
      "maximum": 3.0,
      "description": "Share of the plan's included usage consumed in 28 days (can exceed 1 with overage)."
    },
    "limit_hits_14d": {
      "type": "number",
      "minimum": 0,
      "maximum": 60,
      "description": "Times a 5-hour or weekly usage cap blocked a request in 14 days."
    },
    "cheap_model_share_28d": {
      "type": "number",
      "minimum": 0.0,
      "maximum": 1.0,
      "description": "Share of requests routed to a cheaper / auto model (rationing signal)."
    },
    "overage_usd_28d": {
      "type": "number",
      "minimum": 0.0,
      "maximum": 5000.0,
      "description": "Usage billed above the plan in 28 days (USD)."
    },
    "overage_toggled_off": {
      "type": "number",
      "enum": [
        0,
        1
      ],
      "description": "1 if paid overage was switched off or capped after being on."
    },
    "suggestion_accept_rate_28d": {
      "type": "number",
      "minimum": 0.0,
      "maximum": 1.0,
      "description": "Accepted / shown inline suggestions in 28 days."
    },
    "accept_rate_change": {
      "type": "number",
      "minimum": 0.0,
      "maximum": 3.0,
      "description": "Accept rate this 28 days / previous 28 days (1 = unchanged)."
    },
    "agent_task_success_rate": {
      "type": "number",
      "minimum": 0.0,
      "maximum": 1.0,
      "description": "Agent tasks that ended with the change kept (not reverted) in 28 days."
    },
    "failed_requests_rate": {
      "type": "number",
      "minimum": 0.0,
      "maximum": 1.0,
      "description": "Share of requests that errored or timed out in 28 days."
    },
    "incident_exposed_28d": {
      "type": "number",
      "enum": [
        0,
        1
      ],
      "description": "1 if the subscriber had requests during a declared incident window."
    },
    "support_tickets_90d": {
      "type": "number",
      "minimum": 0,
      "maximum": 50,
      "description": "Support tickets opened in 90 days."
    },
    "ide_sessions_28d": {
      "type": "number",
      "minimum": 0,
      "maximum": 500,
      "description": "IDE-extension sessions in 28 days."
    },
    "cli_sessions_28d": {
      "type": "number",
      "minimum": 0,
      "maximum": 500,
      "description": "CLI-agent sessions in 28 days."
    },
    "weekend_usage_ratio": {
      "type": "number",
      "minimum": 0.0,
      "maximum": 1.0,
      "description": "Share of activity on weekends (side-project signal)."
    },
    "first_renewal_after_pricing_change": {
      "type": "number",
      "enum": [
        0,
        1
      ],
      "description": "1 if this is the subscriber's first renewal since the last limit / pricing change."
    }
  }
}
