{
  "user_id": "sub_arjun",
  "user_name": "Arjun (worked example)",
  "plan_tier": "pro_plus",
  "renewals_completed": 12,
  "active_days_7d": 5,
  "active_days_28d": 20,
  "last_active_days_ago": 0,
  "agent_requests_28d": 910,
  "allowance_used_pct": 0.66,
  "limit_hits_14d": 0,
  "cheap_model_share_28d": 0.18,
  "overage_usd_28d": 0.0,
  "overage_toggled_off": 0,
  "suggestion_accept_rate_28d": 0.33,
  "accept_rate_change": 1.03,
  "agent_task_success_rate": 0.69,
  "failed_requests_rate": 0.03,
  "incident_exposed_28d": 1,
  "support_tickets_90d": 1,
  "ide_sessions_28d": 41,
  "cli_sessions_28d": 12,
  "weekend_usage_ratio": 0.12,
  "first_renewal_after_pricing_change": 0,
  "engagement_trend": 1.0
}
