{
  "user_id": "sub_00310",
  "user_name": "Alex Garcia",
  "plan_tier": "ultra",
  "renewals_completed": 1,
  "active_days_7d": 1,
  "active_days_28d": 6,
  "engagement_trend": 0.6667,
  "last_active_days_ago": 2,
  "agent_requests_28d": 263,
  "allowance_used_pct": 0.0306,
  "limit_hits_14d": 0,
  "cheap_model_share_28d": 0.2936,
  "overage_usd_28d": 0.0,
  "overage_toggled_off": 0,
  "suggestion_accept_rate_28d": 0.2249,
  "accept_rate_change": 0.7815,
  "agent_task_success_rate": 0.567,
  "failed_requests_rate": 0.0777,
  "incident_exposed_28d": 1,
  "support_tickets_90d": 2,
  "ide_sessions_28d": 8,
  "cli_sessions_28d": 1,
  "weekend_usage_ratio": 0.4465,
  "first_renewal_after_pricing_change": 1
}
